Unnamed: 0,Image,Information,Rating,Latitude,Longitude,Label,Address
117,data/Pho/q3.jpg,Phở Lý Quốc Sư - Gò Vấp,4.8,10.815709788725698,106.67809811936586,18,"Chợ Tân Sơn Nhất, 3, Nguyễn Thái Sơn, Phường 3, Quận Gò Vấp, Thành phố Hồ Chí Minh, 71409, Việt Nam"
118,data/Pho/q4.jpg,Phở Kiêm,4.1,10.83314647903194,106.6703543999941,18,"74, Hẻm 312 Đường Quang Trung, Phường 10, Quận Gò Vấp, Thành phố Hồ Chí Minh, 72100, Việt Nam"
119,data/Xoi_xeo/q1.jpg,MR_XÔI - XÔI GÀ _ XÔI XÉO _ XÔI BẮC,5.0,10.845009448686216,106.66028988470948,29,"266, Đường số 8, Phường 11, Quận Gò Vấp, Thành phố Hồ Chí Minh, 71500, Việt Nam"
120,data/Xoi_xeo/q2.jpg,Xôi Làng Nghề - Chuẩn Vị Bắc - Nguyễn Công Trứ Q1,4.5,10.769674302691506,106.70275401347688,29,"81, Nguyễn Công Trứ, Khu phố 1, Phường Nguyễn Thái Bình, Quận 1, Thành phố Hồ Chí Minh, 71010, Việt Nam"
121,data/Xoi_xeo/q3.jpg,Xôi xéo Hà Nội,4.3,10.788259795364771,106.6916380978201,29,"Hai Bà Trưng, Phường Võ Thị Sáu, Quận 3, Thành phố Hồ Chí Minh, 72210, Việt Nam"
